{
  "_doc": "Escalon \"buena\" de la ADR 0033. REVISADO (paquete AS, ADR 0070, cierra AR-A): correcta, con la linea de sinergia de ROBO Y RECUPERACION -presion diagonal, veterano del foso, lector de carriles y la voz del capitan, que multiplica la entrada de todo el equipo- y con TRES perks de escalado ALIMENTADOS a la mitad de su pico. Tres, no siete: el banco mide que una run de la doctrina contextual termina con 3,24 perks de acumulacion distintos (mediana 3), y con siete la celda buena del jefe del acto 2 se iba a 85,4 sobre una banda que acaba en 72. Y los contadores no se escriben a ojo: son la MITAD del pico medio que el banco mide para cada contador (RF-070), que es lo que la ADR 0033 llama alimentados. Van los ultimos de su slot porque es lo que la densidad de la ADR 0040 mide.",
  "id": "orc_good",
  "name": "Orcos: buena",
  "race": "Orc",
  "quality": 50,
  "rarity": "common",
  "perks": [
    {
      "slot": 0,
      "perk": "home_ref"
    },
    {
      "slot": 0,
      "perk": "sweeper_keeper"
    },
    {
      "slot": 1,
      "perk": "covering_shadow"
    },
    {
      "slot": 1,
      "perk": "pit_veteran"
    },
    {
      "slot": 2,
      "perk": "last_ditch"
    },
    {
      "slot": 2,
      "perk": "diagonal_press"
    },
    {
      "slot": 3,
      "perk": "brute_boots"
    },
    {
      "slot": 3,
      "perk": "captains_voice"
    },
    {
      "slot": 4,
      "perk": "wing_overlap"
    },
    {
      "slot": 4,
      "perk": "battle_reader"
    },
    {
      "slot": 5,
      "perk": "crowd_control"
    },
    {
      "slot": 5,
      "perk": "flank_specialist"
    },
    {
      "slot": 6,
      "perk": "sharpshooter_drill"
    },
    {
      "slot": 6,
      "perk": "box_predator"
    }
  ],
  "lineup": null,
  "styles": {
    "0": "Brute",
    "1": "Brute",
    "2": "Brute",
    "3": "Brute",
    "4": "Brute",
    "5": "Brute",
    "6": "Brute"
  },
  "counters": {
    "1": {
      "pitVeteranTackles": 3
    },
    "3": {
      "captainsVoiceMatches": 4
    },
    "4": {
      "battleReaderMatches": 4
    },
    "6": {
      "sharpshooterShots": 2
    }
  }
}
