{
  "id": "elf_tiki_taka",
  "name": "Elfos: toque",
  "race": "Elf",
  "quality": 50,
  "perks": [
    {
      "slot": 0,
      "perk": "safety_net"
    },
    {
      "slot": 1,
      "perk": "fine_touch"
    },
    {
      "slot": 1,
      "perk": "own_third_anchor"
    },
    {
      "slot": 2,
      "perk": "fine_touch"
    },
    {
      "slot": 2,
      "perk": "own_third_anchor"
    },
    {
      "slot": 3,
      "perk": "fine_touch"
    },
    {
      "slot": 3,
      "perk": "first_touch_school"
    },
    {
      "slot": 4,
      "perk": "fine_touch"
    },
    {
      "slot": 4,
      "perk": "covering_shadow"
    },
    {
      "slot": 5,
      "perk": "fine_touch"
    },
    {
      "slot": 6,
      "perk": "fine_touch"
    },
    {
      "slot": 6,
      "perk": "box_predator"
    },
    {
      "slot": 6,
      "perk": "forward_line"
    },
    {
      "slot": 5,
      "perk": "crowd_control"
    },
    {
      "slot": 0,
      "perk": "fine_touch"
    }
  ],
  "rarities": {
    "6": "uncommon"
  },
  "styles": {
    "1": "Fine",
    "2": "Fine",
    "3": "Fine",
    "4": "Fine",
    "5": "Fine",
    "6": "Fine",
    "0": "Fine"
  },
  "lineup": null
}
