{
  "_doc": "Escalon \"muy buena\" de la ADR 0033: la salvaguarda de la ADR 0027 se mide sobre esta build (tres titulares poco comunes, NINGUN legendario ni raro). REVISADO (paquete AS, ADR 0070, cierra AR-A): buena, mas la segunda linea (lider natural con su rasgo, guerrero de carretera, cazagoles), equipada -los siete titulares llevan objeto, RF-076- y con CUATRO acumuladores al PICO ENTERO, que es lo que la ADR 0033 llama el escalado acumulado durante toda la run. Cuatro porque el banco mide 4,67 acumuladores distintos en la PLANTILLA de las runs que se ganan y el 83% de los perks de una plantilla estan en el once (10,27 de 12,35), o sea 3,9 en el once. Cada contador va a SU pico medido y no a un 5 plano: silkyVeteranDribbles llega a 3 y no a 5 porque un regate ganado no se acumula al ritmo de un partido jugado, y esa diferencia es real. Sin alineacion propia: la de hoy alimentaba a spearpoint, que ya no esta, y romperia los vinculos de los perks de alineacion que si estan. ADR 0107: los tres berserker_totem salen. Valian +132 medidos cada uno -la maldicion era una ganga- y la build 'excelente' se apoyaba en ellos; desde que el maldito vale NEGATIVO por diseno, una build excelente compra los mejores NORMALES (champions_sash en los centrales, quicksilver_harness en el medio). Medido: sin este cambio, bossGate_eternal_crown_excellent caia a 46,70 contra una banda de 50-70.",
  "id": "dwarf_excellent",
  "name": "Enanos: muy buena",
  "race": "Dwarf",
  "quality": 50,
  "rarity": "common",
  "perks": [
    {
      "slot": 0,
      "perk": "home_ref"
    },
    {
      "slot": 0,
      "perk": "clean_sheet_legacy"
    },
    {
      "slot": 1,
      "perk": "covering_shadow"
    },
    {
      "slot": 1,
      "perk": "pit_veteran"
    },
    {
      "slot": 2,
      "perk": "lane_reader"
    },
    {
      "slot": 2,
      "perk": "road_warrior"
    },
    {
      "slot": 2,
      "perk": "last_ditch"
    },
    {
      "slot": 3,
      "perk": "iron_gate"
    },
    {
      "slot": 3,
      "perk": "natural_leader"
    },
    {
      "slot": 3,
      "perk": "captains_voice"
    },
    {
      "slot": 4,
      "perk": "wing_overlap"
    },
    {
      "slot": 4,
      "perk": "battle_reader"
    },
    {
      "slot": 5,
      "perk": "crowd_control"
    },
    {
      "slot": 5,
      "perk": "flank_specialist"
    },
    {
      "slot": 6,
      "perk": "sharpshooter_drill"
    },
    {
      "slot": 6,
      "perk": "poacher_instinct"
    },
    {
      "slot": 6,
      "perk": "box_predator"
    }
  ],
  "rarities": {
    "2": "uncommon",
    "3": "uncommon",
    "6": "uncommon"
  },
  "lineup": null,
  "styles": {
    "0": "Bulwark",
    "1": "Bulwark",
    "2": "Bulwark",
    "3": "Bulwark",
    "4": "Bulwark",
    "5": "Bulwark",
    "6": "Bulwark"
  },
  "traits": {
    "3": [
      "Leader"
    ]
  },
  "counters": {
    "0": {
      "cleanSheetSaves": 6
    },
    "1": {
      "pitVeteranTackles": 5
    },
    "2": {
      "laneReaderRecoveries": 6
    },
    "3": {
      "captainsVoiceMatches": 8
    },
    "4": {
      "battleReaderMatches": 7
    },
    "6": {
      "sharpshooterShots": 4,
      "poacherInstinctGoals": 4
    }
  },
  "items": {
    "0": "focus_lens",
    "1": "champions_sash",
    "2": "champions_sash",
    "3": "focus_lens",
    "4": "endurance_belt",
    "5": "quicksilver_harness",
    "6": "worn_boots"
  }
}
