{
  "id": "dwarf_fortress",
  "name": "Enanos: fortaleza",
  "race": "Dwarf",
  "quality": 50,
  "perks": [
    {
      "slot": 0,
      "perk": "sweeper_keeper"
    },
    {
      "slot": 0,
      "perk": "safety_net"
    },
    {
      "slot": 0,
      "perk": "iron_gate"
    },
    {
      "slot": 0,
      "perk": "clean_sheet_legacy"
    },
    {
      "slot": 1,
      "perk": "own_third_anchor"
    },
    {
      "slot": 1,
      "perk": "bulwark_stance"
    },
    {
      "slot": 2,
      "perk": "own_third_anchor"
    },
    {
      "slot": 2,
      "perk": "bulwark_stance"
    },
    {
      "slot": 3,
      "perk": "center_conductor"
    },
    {
      "slot": 3,
      "perk": "last_ditch"
    },
    {
      "slot": 4,
      "perk": "last_ditch"
    },
    {
      "slot": 4,
      "perk": "covering_shadow"
    },
    {
      "slot": 5,
      "perk": "bulwark_stance"
    },
    {
      "slot": 5,
      "perk": "immovable"
    },
    {
      "slot": 6,
      "perk": "box_predator"
    },
    {
      "slot": 6,
      "perk": "forward_line"
    }
  ],
  "rarities": {
    "0": "rare"
  },
  "lineup": null,
  "styles": {
    "1": "Bulwark",
    "2": "Bulwark",
    "5": "Bulwark"
  }
}
