{
  "_doc": "Escalon \"correcta\" de la ADR 0033. REVISADO (paquete AS, ADR 0070, cierra AR-A): los catorce perks son los que la doctrina contextual termina llevando de verdad -listón del 15% de presencia en las 240 runs de la raza- y estan colocados donde su condicion se cumple. El ORDEN dentro de cada slot es parte del diseno y no cosmetica: BuildDensity recorta por rondas conservando el ULTIMO perk de cada slot, asi que a la densidad de la ADR 0040 la puerta mide CINCO de los catorce, y son los ultimos. Lo que separa este escalon del siguiente es que no hay linea de sinergia y, sobre todo, que los acumuladores estan SIN ALIMENTAR, que es exactamente lo que le pasa a quien compra un perk de acumulacion al final de la run. Antes llevaba clean_sheet_legacy en el ultimo lugar del slot 0 -el perk que la run compraba en el 0,2% de las veces- y own_third_anchor (2,1%) y box_predator (2,2%).",
  "id": "elf_correct",
  "name": "Elfos: correcta",
  "race": "Elf",
  "quality": 50,
  "rarity": "common",
  "perks": [
    {
      "slot": 0,
      "perk": "clean_sheet_legacy"
    },
    {
      "slot": 0,
      "perk": "sweeper_keeper"
    },
    {
      "slot": 1,
      "perk": "pit_veteran"
    },
    {
      "slot": 1,
      "perk": "diagonal_press"
    },
    {
      "slot": 2,
      "perk": "lane_reader"
    },
    {
      "slot": 2,
      "perk": "pivot_duo"
    },
    {
      "slot": 3,
      "perk": "silky_veteran"
    },
    {
      "slot": 3,
      "perk": "game_management"
    },
    {
      "slot": 4,
      "perk": "battle_reader"
    },
    {
      "slot": 4,
      "perk": "wing_overlap"
    },
    {
      "slot": 5,
      "perk": "crowd_control"
    },
    {
      "slot": 5,
      "perk": "flank_specialist"
    },
    {
      "slot": 6,
      "perk": "sharpshooter_drill"
    },
    {
      "slot": 6,
      "perk": "box_predator"
    }
  ],
  "lineup": null,
  "styles": {
    "0": "Fine",
    "1": "Fine",
    "2": "Fine",
    "3": "Fine",
    "4": "Fine",
    "5": "Fine",
    "6": "Fine"
  },
  "counters": {}
}
