{
  "id": "elf_glass",
  "name": "Elfos: cristal",
  "race": "Elf",
  "quality": 50,
  "perks": [
    {
      "slot": 0,
      "perk": "safety_net"
    },
    {
      "slot": 0,
      "perk": "sweeper_keeper"
    },
    {
      "slot": 1,
      "perk": "own_third_anchor"
    },
    {
      "slot": 1,
      "perk": "pivot_duo"
    },
    {
      "slot": 2,
      "perk": "fine_touch"
    },
    {
      "slot": 2,
      "perk": "pivot_duo"
    },
    {
      "slot": 3,
      "perk": "center_conductor"
    },
    {
      "slot": 4,
      "perk": "fine_touch"
    },
    {
      "slot": 4,
      "perk": "crowd_control"
    },
    {
      "slot": 5,
      "perk": "fine_touch"
    },
    {
      "slot": 5,
      "perk": "wing_overlap"
    },
    {
      "slot": 6,
      "perk": "forward_line"
    },
    {
      "slot": 6,
      "perk": "silky_veteran"
    },
    {
      "slot": 6,
      "perk": "crowd_control"
    },
    {
      "slot": 3,
      "perk": "spearpoint"
    },
    {
      "slot": 0,
      "perk": "hand_of_god"
    },
    {
      "slot": 1,
      "perk": "last_man"
    },
    {
      "slot": 4,
      "perk": "tough_hide"
    },
    {
      "slot": 4,
      "perk": "shadow"
    },
    {
      "slot": 5,
      "perk": "cannon"
    },
    {
      "slot": 6,
      "perk": "double_shot"
    },
    {
      "slot": 4,
      "perk": "free_man"
    },
    {
      "slot": 2,
      "perk": "bloodhound"
    },
    {
      "slot": 2,
      "perk": "bodyguard"
    },
    {
      "slot": 0,
      "perk": "shouting_wall"
    },
    {
      "slot": 1,
      "perk": "eyed_coward"
    },
    {
      "slot": 3,
      "perk": "bull_rush"
    },
    {
      "slot": 4,
      "perk": "silver_tongue"
    },
    {
      "slot": 5,
      "perk": "nutmeg"
    },
    {
      "slot": 6,
      "perk": "never_tracks_back"
    },
    {
      "slot": 6,
      "perk": "point_blank"
    },
    {
      "slot": 2,
      "perk": "ankle_bite"
    }
  ],
  "rarities": {
    "6": "uncommon"
  },
  "styles": {
    "2": "Fine",
    "3": "Fine",
    "4": "Fine",
    "5": "Fine"
  },
  "lineup": null,
  "_doc": "TANDA 2: se anaden aqui los perks de la tanda 2 que necesitan portador (EveryCatalogPerkIsAssignedInSomeBuild). Esta build esta FUERA de data/balance/groups.json a proposito, asi que no alimenta ninguna puerta calibrada; por eso se elige para esto. Los perks nuevos van al FINAL de su slot: el orden dentro de un slot es diseno (BuildDensity recorta conservando el ultimo), asi que no se reordena nada de lo que ya habia. PAQUETE DE ACTOS (26 sep 2026): mismo motivo, se anaden al final shouting_wall (portero), eyed_coward y ankle_bite (defensas), bull_rush, silver_tongue, nutmeg, never_tracks_back y point_blank (delantero)."
}
