{
  "_doc": "Escalon MALO de la puerta de fase 1 (ADR 0106). REDEFINIDO el 13 sep 2026: la definicion anterior -catorce perks que dependen de linked() colocados para que NINGUNO resuelva- dejo de describir una build mala el dia de la ADR 0088. Desde que 'ningun perk es negativo' y la rama else no hace nada, un perk que no se dispara NO CASTIGA: no hace nada. Es decir, esa build no era mala, era NEUTRA, y el criterio 'las malas pierden <=45 %' se habia vuelto insatisfacible por construccion (CAT-E). Decision del revisor: mala es 'sin sentido, sin sinergias, con objetos mal colocados', y una plantilla con CERO perks no existe -las recompensas solo dan perks desde la ADR 0055, rewardItemWeight 0-. Asi que esta build lleva los MISMOS catorce perks que la referencia neutra (se disparan, no se suman) y se diferencia de ella en una sola cosa medible: los objetos MALDITOS en el portador equivocado. Cada maldito resta sobre lo que su rol mas necesita -menos fuerza a los centrales que entran, menos tecnica a los medios que pasan, menos velocidad al portero y al delantero-, que es exactamente la jugada de human_excellent al reves: alli el berserker_totem va a quien no necesita tecnica. Los objetos malditos SI restan de verdad (atributos, no rama else), asi que desde la ADR 0088 son la unica forma que queda de construir EN CONTRA. AJUSTE (13 sep 2026, misma ADR): la alineacion pasa de DISPERSA a AMONTONADA. Con cinco filas, poner gente en las filas 0 y 4 era irse a los dos bordes y no resolver ninguna relacion direccional; con SEIS filas (ADR 0103) ese mismo reparto es abrir el campo a lo ancho, que es jugar bien -medido: 66,67 % contra la referencia, o sea la 'build mala' ganaba-. La mala colocacion en un campo mas ancho es la contraria: siete jugadores apinados en el cuarto defensivo, estorbandose, sin anchura y sin nadie arriba. El nombre 'scattered' se queda por continuidad de la metrica.",
  "id": "human_scattered",
  "name": "Humanos: dispersos",
  "race": "Human",
  "quality": 50,
  "perks": [
    {
      "slot": 0,
      "perk": "box_predator"
    },
    {
      "slot": 0,
      "perk": "brute_boots"
    },
    {
      "slot": 1,
      "perk": "pack_mentality"
    },
    {
      "slot": 1,
      "perk": "road_warrior"
    },
    {
      "slot": 2,
      "perk": "steady_hands"
    },
    {
      "slot": 2,
      "perk": "pit_veteran"
    },
    {
      "slot": 3,
      "perk": "back_to_back"
    },
    {
      "slot": 3,
      "perk": "flank_specialist"
    },
    {
      "slot": 4,
      "perk": "cold_focus"
    },
    {
      "slot": 4,
      "perk": "long_leash_legacy"
    },
    {
      "slot": 5,
      "perk": "high_press_trigger"
    },
    {
      "slot": 5,
      "perk": "home_ref"
    },
    {
      "slot": 6,
      "perk": "iron_lungs"
    },
    {
      "slot": 6,
      "perk": "comeback_spirit"
    }
  ],
  "items": {
    "0": "brutes_pauldron",
    "1": "martyrs_relic",
    "2": "martyrs_relic",
    "3": "berserker_totem",
    "4": "berserker_totem",
    "5": "berserker_totem",
    "6": "brutes_pauldron"
  },
  "lineup": [
    [
      0,
      2
    ],
    [
      1,
      1
    ],
    [
      1,
      2
    ],
    [
      2,
      1
    ],
    [
      2,
      2
    ],
    [
      3,
      1
    ],
    [
      3,
      2
    ]
  ]
}
