{
  "id": "orc_violence",
  "name": "Orcos: carnicería",
  "race": "Orc",
  "quality": 50,
  "perks": [
    {
      "slot": 0,
      "perk": "safety_net"
    },
    {
      "slot": 0,
      "perk": "sweeper_keeper"
    },
    {
      "slot": 1,
      "perk": "brute_boots"
    },
    {
      "slot": 1,
      "perk": "bruised_knuckles"
    },
    {
      "slot": 2,
      "perk": "brute_boots"
    },
    {
      "slot": 2,
      "perk": "bruised_knuckles"
    },
    {
      "slot": 3,
      "perk": "bruised_knuckles"
    },
    {
      "slot": 3,
      "perk": "center_conductor"
    },
    {
      "slot": 4,
      "perk": "bruised_knuckles"
    },
    {
      "slot": 5,
      "perk": "bruised_knuckles"
    },
    {
      "slot": 6,
      "perk": "box_predator"
    },
    {
      "slot": 6,
      "perk": "forward_line"
    },
    {
      "slot": 4,
      "perk": "brute_boots"
    },
    {
      "slot": 6,
      "perk": "poacher_instinct"
    },
    {
      "slot": 5,
      "perk": "scar_tissue"
    }
  ],
  "rarities": {
    "6": "uncommon"
  },
  "lineup": null
}
